{
  "schema": "system_compiler.world_compare/v0",
  "kind": "system_compiler.world_compare",
  "generated_at_utc": "2026-05-04T12:35:47Z",
  "generator": "scripts/compare_system_compiler_world.py",
  "result": "ok",
  "world_verdict": "collapsed",
  "world": {
    "name": "minimal_kernel_runtime",
    "title": "Minimal Kernel Runtime Witness World",
    "summary": "A canonical witness surface that gathers artifact report, runtime evidence bundle, and representative host examples into one verifiable world.",
    "subject": {
      "profile": "MCU_MIN",
      "board": "armv7a_qemu",
      "active_facets": [
        "runtime",
        "trap",
        "syscall",
        "message"
      ]
    },
    "first_class_terms": [
      "subject",
      "case",
      "fact",
      "contract",
      "witness",
      "transition"
    ],
    "core_questions": [
      "What system fact is this world trying to prove?",
      "Which witness closes the upper-half and lower-half loop?",
      "Which contracts explain why this world is allowed to exist?"
    ],
    "compare_questions": [
      "If this world drifts, which witness breaks first?",
      "If a contract tightens, which witness becomes invalid?",
      "If a capability disappears, what is the smallest collapse surface?"
    ],
    "contract_refs": [
      "docs/system/artifact_report_v0.md",
      "docs/system/minimal_kernel_runtime_evidence_bundle_contract.md",
      "docs/system/minimal_kernel_trap_ingress_contract.md"
    ]
  },
  "artifact_context": {
    "baseline_witness_bundle": "schemas/examples/system_compiler.witness_bundle.v0.sample.json",
    "candidate_witness_bundle": "schemas/examples/system_compiler.witness_bundle.v0.candidate_drift.sample.json",
    "output_root": "schemas/examples",
    "report_markdown_path": "docs/system/world_compare_v0.md",
    "check_text_path": "docs/system/world_compare_v0.md"
  },
  "bundle_status": {
    "baseline_result": "ok",
    "candidate_result": "fail",
    "baseline_state": "standing",
    "candidate_state": "collapsed",
    "baseline_required_missing_count": 0,
    "candidate_required_missing_count": 0,
    "baseline_missing_contract_count": 0,
    "candidate_missing_contract_count": 1
  },
  "world_changes": {
    "changed": true,
    "summary_changed": true,
    "subject_changes": [],
    "first_class_term_changes": {
      "added": [],
      "removed": [
        "session",
        "ingress"
      ]
    },
    "core_question_changes": {
      "added": [],
      "removed": []
    },
    "compare_question_changes": {
      "added": [],
      "removed": []
    },
    "contract_ref_changes": {
      "added": [
        "docs/system/minimal_kernel_trap_ingress_contract.md"
      ],
      "removed": []
    },
    "witness_plan_changes": {
      "added": [],
      "removed": [
        "kernel_runtime_session"
      ]
    }
  },
  "contract_drift": {
    "changed": true,
    "present_ref_changes": {
      "added": [],
      "removed": []
    },
    "missing_ref_changes": {
      "added": [
        "docs/system/minimal_kernel_trap_ingress_contract.md"
      ],
      "removed": []
    }
  },
  "witness_summary": {
    "baseline_entry_count": 4,
    "candidate_entry_count": 3,
    "changed_entry_count": 2,
    "added_entry_count": 0,
    "removed_entry_count": 1,
    "unchanged_entry_count": 2,
    "regression_count": 2,
    "improvement_count": 0,
    "neutral_change_count": 0,
    "required_regression_count": 2
  },
  "witness_changes": [
    {
      "id": "runtime_bundle_sample",
      "change_kind": "changed",
      "impact": "regression",
      "required": true,
      "kind": "runtime_evidence_bundle",
      "label": "minimal-kernel-runtime-evidence",
      "layer": "bundle",
      "role": "upper-half and lower-half runtime evidence aggregation",
      "witness_focus": [
        "upper-half",
        "lower-half",
        "bundle"
      ],
      "left_status": "ok",
      "right_status": "fail",
      "left_source_path": "schemas/examples/minimal_kernel.runtime_evidence_bundle.summary.v1.sample.json",
      "right_source_path": "schemas/examples/minimal_kernel.runtime_evidence_bundle.summary.v1.sample.json",
      "subject_changes": [],
      "observations_added": [
        "result=fail",
        "qemu=ok:8 fail:1 other:0"
      ],
      "observations_removed": [
        "result=ok",
        "qemu_cases=4/4",
        "qemu=ok:4 fail:0 other:0"
      ],
      "artifact_refs_added": [],
      "artifact_refs_removed": [],
      "metadata_changes": []
    },
    {
      "id": "kernel_runtime_session",
      "change_kind": "removed",
      "impact": "regression",
      "required": true,
      "kind": "kernel_runtime_session",
      "label": "kernel-runtime-session",
      "layer": "bundle",
      "role": "shared runtime session object",
      "witness_focus": [
        "session",
        "runtime",
        "ingress",
        "continuity"
      ],
      "left_status": "ok",
      "right_status": "absent",
      "left_source_path": "schemas/examples/minimal_kernel.kernel_runtime_session.v0.sample.json",
      "right_source_path": null,
      "subject_changes": [
        "case:minimal_kernel_runtime.armv7a_qemu.debug->None",
        "profile:debug->None",
        "board:armv7a_qemu->None",
        "active_facets:+[] -[session, runtime, ingress, continuity]"
      ],
      "observations_added": [],
      "observations_removed": [
        "session_status=standing",
        "semantic_host=True",
        "machine_qemu=True",
        "trap_ingress=True",
        "runtime_loop=True",
        "handoff_continuity=True"
      ],
      "artifact_refs_added": [],
      "artifact_refs_removed": [
        "schemas/examples/minimal_kernel.kernel_runtime_session.v0.sample.json"
      ],
      "metadata_changes": [
        "kind:kernel_runtime_session->None",
        "label:kernel-runtime-session->None",
        "role:shared runtime session object->None",
        "layer:bundle->None",
        "witness_focus:+[] -[session, runtime, ingress, continuity]",
        "source_path:schemas/examples/minimal_kernel.kernel_runtime_session.v0.sample.json->None"
      ]
    }
  ],
  "session_drift": {
    "present": true,
    "changed": true,
    "baseline_entry_status": "ok",
    "candidate_entry_status": "absent",
    "baseline_session_status": "standing",
    "candidate_session_status": null,
    "drift_domains": [
      "source",
      "verdict",
      "semantic",
      "machine",
      "runtime",
      "handoff"
    ],
    "fact_changes": [
      {
        "key": "entry_status",
        "domain": "source",
        "baseline": "ok",
        "candidate": "absent",
        "impact": "regression"
      },
      {
        "key": "source_path",
        "domain": "source",
        "baseline": "schemas/examples/minimal_kernel.kernel_runtime_session.v0.sample.json",
        "candidate": null,
        "impact": "neutral"
      },
      {
        "key": "session_status",
        "domain": "verdict",
        "baseline": "standing",
        "candidate": null,
        "impact": "regression"
      },
      {
        "key": "semantic_host",
        "domain": "semantic",
        "baseline": "True",
        "candidate": null,
        "impact": "neutral"
      },
      {
        "key": "machine_qemu",
        "domain": "machine",
        "baseline": "True",
        "candidate": null,
        "impact": "neutral"
      },
      {
        "key": "trap_ingress",
        "domain": "machine",
        "baseline": "True",
        "candidate": null,
        "impact": "neutral"
      },
      {
        "key": "runtime_loop",
        "domain": "runtime",
        "baseline": "True",
        "candidate": null,
        "impact": "neutral"
      },
      {
        "key": "handoff_continuity",
        "domain": "handoff",
        "baseline": "True",
        "candidate": null,
        "impact": "neutral"
      }
    ],
    "narratives": [
      "kernel_runtime_session witness was removed from the candidate bundle",
      "session `entry_status` changed `ok` -> `absent` in domain `source`",
      "session `source_path` changed `schemas/examples/minimal_kernel.kernel_runtime_session.v0.sample.json` -> `None` in domain `source`",
      "session `session_status` changed `standing` -> `None` in domain `verdict`",
      "session `semantic_host` changed `True` -> `None` in domain `semantic`",
      "session `machine_qemu` changed `True` -> `None` in domain `machine`"
    ]
  },
  "collapse_surface": {
    "changed": true,
    "regressed_witnesses": [
      "runtime_bundle_sample",
      "kernel_runtime_session"
    ],
    "required_regressed_witnesses": [
      "runtime_bundle_sample",
      "kernel_runtime_session"
    ],
    "failing_candidate_witnesses": [
      "runtime_bundle_sample"
    ],
    "missing_candidate_witnesses": [],
    "added_missing_contract_refs": [
      "docs/system/minimal_kernel_trap_ingress_contract.md"
    ],
    "affected_layers": [
      "bundle"
    ],
    "affected_focus": [
      "upper-half",
      "lower-half",
      "bundle",
      "session",
      "runtime",
      "ingress",
      "continuity",
      "source",
      "verdict",
      "semantic",
      "machine",
      "handoff"
    ],
    "session_drift": {
      "changed": false,
      "regressed_sessions": [],
      "required_regressed_sessions": [],
      "affected_domains": [],
      "affected_focus": [],
      "missing_runtime_facts": [],
      "failure_codes": [],
      "narratives": []
    },
    "narratives": [
      "witness `runtime_bundle_sample` regressed `ok` -> `fail` on layer `bundle`",
      "witness `kernel_runtime_session` regressed `ok` -> `absent` on layer `bundle`",
      "candidate is missing contract ref `docs/system/minimal_kernel_trap_ingress_contract.md`",
      "candidate witness bundle no longer stands as `ok`",
      "kernel_runtime_session witness was removed from the candidate bundle",
      "session `entry_status` changed `ok` -> `absent` in domain `source`",